{
  "acceptance_criteria": [],
  "baseline_revision": "9000574c4c8807e84c4350e2fd342deeba341d7d",
  "changed_file_hashes": {
    "calculator.py": "8b7592a111b9a05664ec660fb67d926fa3810ff816dd5fb50ea37eae72284c5b"
  },
  "decision": "BLOCKED",
  "developer_commits": [
    "867fde90acf3f0055af79bda53a0fccb55f6bf34"
  ],
  "evidence": {
    "canonical_task_sha256": "a5c11c720f0371c57322524e866338349beb1933b82173a8ba3bf0dd044ba9df",
    "cto_plan_sha256": "01ee8d677754b7a257cb009df93ad9dbb42c6f72cff09aa5724c4c17e3de96b3",
    "developer_reports": {
      "backend-subtract": {
        "path": "/var/lib/alfred-development-state/dev-v1-accept/T-0002/report-backend-subtract.json",
        "sha256": "81f924168f3452b3507650ce4f58ace315dbff7fb33de14d42b97550e2cdeb6d"
      }
    },
    "final_worktree": "/var/lib/alfred-development-worktrees/dev-v1-accept-T-0002-final",
    "qa_input_path": "/var/lib/alfred-development-state/dev-v1-accept/T-0002/qa-input.json",
    "qa_input_sha256": "62b2657cb31747b368c0c066107a4afa42ea21350e82563a9b67ed16964a0171"
  },
  "files_inspected": [
    ".dev/task-id-reservations.txt",
    ".dev/tasks/.gitkeep",
    "calculator.py",
    "test_calculator.py"
  ],
  "final_revision": "89ba188f8a2f801d433a30c9c21363efb3e1043d",
  "findings": [
    {
      "detail": "bwrap: Creating new namespace failed: Resource temporarily unavailable",
      "requirement": "execution_capability",
      "severity": "medium"
    }
  ],
  "next_authorized_action": "resolve_qa_blocker",
  "project": "dev-v1-accept",
  "qa_model": null,
  "schema": "alfred.qa-report/1",
  "task_id": "T-0002",
  "tests": []
}
